<?xml version="1.0" encoding="UTF-8"?>
<!-- edited with XML Spy v3.5 NT (http://www.xmlspy.com) by Jay Tracy (Snap2 Corporation) -->
<!DOCTYPE TestSuite SYSTEM "../../testconfig.dtd">
<TestSuite>
	<!-- OBJECT DEFINITIONS FOR REUSE -->
	<Object type="null" id="null"/>
	<Object type="org.havi.ui.HScreenRectangle" id="HSR_fullscreen">
		<Parameter type="float" value="0.0"/>
		<Parameter type="float" value="0.0"/>
		<Parameter type="float" value="1.0"/>
		<Parameter type="float" value="1.0"/>
	</Object>
	<Object type="org.havi.ui.HScreenDimension" id="HSD_1_1">
		<Parameter type="float" value="1.0"/>
		<Parameter type="float" value="1.0"/>
	</Object>
	<Object type="org.havi.ui.HScreenPoint" id="HSP_0_0">
		<Parameter type="float" value="0.0"/>
		<Parameter type="float" value="0.0"/>
	</Object>
	<Object type="java.awt.Dimension" id="dim_1920_1080">
		<Parameter type="int" value="1920"/>
		<Parameter type="int" value="1080"/>
	</Object>
	<Object type="java.awt.Dimension" id="dim_1280_720">
		<Parameter type="int" value="1280"/>
		<Parameter type="int" value="720"/>
	</Object>
	<Object type="java.awt.Dimension" id="dim_640_480">
		<Parameter type="int" value="640"/>
		<Parameter type="int" value="480"/>
	</Object>
	<Object type="java.awt.Point" id="point_0_0">
		<Parameter type="int" value="0"/>
		<Parameter type="int" value="0"/>
	</Object>
	<!-- TEMPLATE DEFINITIONS FOR REUSE -->
	<!-- Graphics Configurations -->
	<!-- 480i -->
	<Template type="org.havi.ui.HGraphicsConfigTemplate" id="gfx0.cfg0" device="Graphics[0]">
		<Preference name="FLICKER_FILTERING" priority="REQUIRED_NOT"/>
		<Preference name="INTERLACED_DISPLAY" priority="REQUIRED"/>
		<Preference name="PIXEL_ASPECT_RATIO" priority="REQUIRED">
			<Object type="java.awt.Dimension">
				<Parameter type="int" value="1"/>
				<Parameter type="int" value="1"/>
			</Object>
		</Preference>
		<Preference name="PIXEL_RESOLUTION" priority="REQUIRED" objectId="dim_640_480"/>
		<Preference name="SCREEN_RECTANGLE" priority="REQUIRED" objectId="HSR_fullscreen"/>
		<Preference name="MATTE_SUPPORT" priority="DONT_CARE"/>
		<Preference name="IMAGE_SCALING_SUPPORT" priority="DONT_CARE"/>
	</Template>
	<!-- 480p -->
	<Template type="org.havi.ui.HGraphicsConfigTemplate" id="gfx0.cfg1" device="Graphics[0]">
		<Preference name="FLICKER_FILTERING" priority="REQUIRED_NOT"/>
		<Preference name="INTERLACED_DISPLAY" priority="REQUIRED_NOT"/>
		<Preference name="PIXEL_ASPECT_RATIO" priority="REQUIRED">
			<Object type="java.awt.Dimension">
				<Parameter type="int" value="1"/>
				<Parameter type="int" value="1"/>
			</Object>
		</Preference>
		<Preference name="PIXEL_RESOLUTION" priority="REQUIRED" objectId="dim_640_480"/>
		<Preference name="SCREEN_RECTANGLE" priority="REQUIRED" objectId="HSR_fullscreen"/>
		<Preference name="MATTE_SUPPORT" priority="DONT_CARE"/>
		<Preference name="IMAGE_SCALING_SUPPORT" priority="DONT_CARE"/>
	</Template>
	<!-- 720p -->
	<Template type="org.havi.ui.HGraphicsConfigTemplate" id="gfx0.cfg2" device="Graphics[0]">
		<Preference name="FLICKER_FILTERING" priority="REQUIRED_NOT"/>
		<Preference name="INTERLACED_DISPLAY" priority="REQUIRED_NOT"/>
		<Preference name="PIXEL_ASPECT_RATIO" priority="REQUIRED">
			<Object type="java.awt.Dimension">
				<Parameter type="int" value="4"/>
				<Parameter type="int" value="3"/>
			</Object>
		</Preference>
		<Preference name="PIXEL_RESOLUTION" priority="REQUIRED" objectId="dim_640_480"/>
		<Preference name="SCREEN_RECTANGLE" priority="REQUIRED" objectId="HSR_fullscreen"/>
		<Preference name="MATTE_SUPPORT" priority="DONT_CARE"/>
		<Preference name="IMAGE_SCALING_SUPPORT" priority="DONT_CARE"/>
	</Template>
	<!-- 1080i -->
	<Template type="org.havi.ui.HGraphicsConfigTemplate" id="gfx0.cfg2" device="Graphics[0]">
		<Preference name="FLICKER_FILTERING" priority="REQUIRED_NOT"/>
		<Preference name="INTERLACED_DISPLAY" priority="REQUIRED"/>
		<Preference name="PIXEL_ASPECT_RATIO" priority="REQUIRED">
			<Object type="java.awt.Dimension">
				<Parameter type="int" value="4"/>
				<Parameter type="int" value="3"/>
			</Object>
		</Preference>
		<Preference name="PIXEL_RESOLUTION" priority="REQUIRED" objectId="dim_640_480"/>
		<Preference name="SCREEN_RECTANGLE" priority="REQUIRED" objectId="HSR_fullscreen"/>
		<Preference name="MATTE_SUPPORT" priority="DONT_CARE"/>
		<Preference name="IMAGE_SCALING_SUPPORT" priority="DONT_CARE"/>
	</Template>
	<!-- Video Configurations -->
	<!-- 480i -->
	<Template type="org.havi.ui.HVideoConfigTemplate" id="vid0.cfg0" device="Video[0]">
		<Preference name="FLICKER_FILTERING" priority="REQUIRED_NOT"/>
		<Preference name="INTERLACED_DISPLAY" priority="REQUIRED"/>
		<Preference name="PIXEL_ASPECT_RATIO" priority="REQUIRED">
			<Object type="java.awt.Dimension">
				<Parameter type="int" value="1"/>
				<Parameter type="int" value="1"/>
			</Object>
		</Preference>
		<Preference name="PIXEL_RESOLUTION" priority="REQUIRED" objectId="dim_640_480"/>
		<Preference name="SCREEN_RECTANGLE" priority="REQUIRED" objectId="HSR_fullscreen"/>
	</Template>
	<!-- 480p -->
	<Template type="org.havi.ui.HVideoConfigTemplate" id="vid0.cfg1" device="Video[0]">
		<Preference name="FLICKER_FILTERING" priority="REQUIRED_NOT"/>
		<Preference name="INTERLACED_DISPLAY" priority="REQUIRED_NOT"/>
		<Preference name="PIXEL_ASPECT_RATIO" priority="REQUIRED">
			<Object type="java.awt.Dimension">
				<Parameter type="int" value="1"/>
				<Parameter type="int" value="1"/>
			</Object>
		</Preference>
		<Preference name="PIXEL_RESOLUTION" priority="REQUIRED" objectId="dim_640_480"/>
		<Preference name="SCREEN_RECTANGLE" priority="REQUIRED" objectId="HSR_fullscreen"/>
	</Template>
	<!-- 720p -->
	<Template type="org.havi.ui.HVideoConfigTemplate" id="vid0.cfg2" device="Video[0]">
		<Preference name="FLICKER_FILTERING" priority="REQUIRED_NOT"/>
		<Preference name="INTERLACED_DISPLAY" priority="REQUIRED_NOT"/>
		<Preference name="PIXEL_ASPECT_RATIO" priority="REQUIRED">
			<Object type="java.awt.Dimension">
				<Parameter type="int" value="1"/>
				<Parameter type="int" value="1"/>
			</Object>
		</Preference>
		<Preference name="PIXEL_RESOLUTION" priority="REQUIRED" objectId="dim_1280_720"/>
		<Preference name="SCREEN_RECTANGLE" priority="REQUIRED" objectId="HSR_fullscreen"/>
	</Template>
	<!-- 1080i -->
	<Template type="org.havi.ui.HVideoConfigTemplate" id="vid0.cfg3" device="Video[0]">
		<Preference name="FLICKER_FILTERING" priority="REQUIRED_NOT"/>
		<Preference name="INTERLACED_DISPLAY" priority="REQUIRED"/>
		<Preference name="PIXEL_ASPECT_RATIO" priority="REQUIRED">
			<Object type="java.awt.Dimension">
				<Parameter type="int" value="1"/>
				<Parameter type="int" value="1"/>
			</Object>
		</Preference>
		<Preference name="PIXEL_RESOLUTION" priority="REQUIRED" objectId="dim_1920_1080"/>
		<Preference name="SCREEN_RECTANGLE" priority="REQUIRED" objectId="HSR_fullscreen"/>
	</Template>
	<!-- Background Configurations -->
	<!-- None -->
	<Template type="org.havi.ui.HBackgroundConfigTemplate" id="background1_config1" device="Background[0]">
		<Preference name="FLICKER_FILTERING" priority="REQUIRED_NOT"/>
		<Preference name="INTERLACED_DISPLAY" priority="REQUIRED_NOT"/>
		<Preference name="PIXEL_ASPECT_RATIO" priority="REQUIRED">
			<Object type="java.awt.Dimension">
				<Parameter type="int" value="1"/>
				<Parameter type="int" value="1"/>
			</Object>
		</Preference>
		<Preference name="PIXEL_RESOLUTION" priority="REQUIRED" objectId="dim_640_480"/>
		<Preference name="SCREEN_RECTANGLE" priority="REQUIRED" objectId="HSR_fullscreen"/>
		<Preference name="CHANGEABLE_SINGLE_COLOR" priority="REQUIRED"/>
		<Preference name="STILL_IMAGE" priority="REQUIRED_NOT"/>
	</Template>
	<!--
	<Template type="org.havi.ui.HBackgroundConfigTemplate" id="background1_config2" device="Background[0]">
		<Preference name="FLICKER_FILTERING" priority="REQUIRED_NOT"/>
		<Preference name="INTERLACED_DISPLAY" priority="REQUIRED_NOT"/>
		<Preference name="PIXEL_ASPECT_RATIO" priority="REQUIRED">
			<Object type="java.awt.Dimension">
				<Parameter type="int" value="1"/>
				<Parameter type="int" value="1"/>
			</Object>
		</Preference>
		<Preference name="PIXEL_RESOLUTION" priority="REQUIRED" objectId="dim_640_480"/>
		<Preference name="SCREEN_RECTANGLE" priority="REQUIRED" objectId="HSR_fullscreen"/>
		<Preference name="CHANGEABLE_SINGLE_COLOR" priority="REQUIRED"/>
		<Preference name="STILL_IMAGE" priority="REQUIRED"/>
	</Template>
	-->

	<!-- START OF TEST DEFINITIONS -->
	<TestClass name="org.havi.ui.HSceneFactoryTest">
		<Test name="besttemplate">
			<TestCase>
				<!-- SUCCESS - tests pixel size required over screen size, checks calculated screen dimension, and 
						     tests that a HGraphicsConfiguration specified in the template is used if possible. -->
				<Input command="inputtemplate">
					<Template type="org.havi.ui.HSceneTemplate">
						<Preference name="GRAPHICS_CONFIGURATION" priority="REQUIRED">
							<Object type="org.havi.ui.HGraphicsConfiguration" templateId="gfx0.cfg0"/>
						</Preference>
						<Preference name="SCENE_PIXEL_DIMENSION" priority="REQUIRED" objectId="dim_640_480"/>
						<Preference name="SCENE_PIXEL_LOCATION" priority="PREFERRED" objectId="point_0_0"/>
						<Preference name="SCENE_SCREEN_DIMENSION" priority="PREFERRED" objectId="HSD_1_1"/>
						<Preference name="SCENE_SCREEN_LOCATION" priority="PREFERRED" objectId="HSP_0_0"/>
					</Template>
				</Input>
				<Result command="compareequal">
					<Template type="org.havi.ui.HSceneTemplate">
						<Preference name="GRAPHICS_CONFIGURATION" priority="REQUIRED">
							<Object type="org.havi.ui.HGraphicsConfiguration" templateId="gfx0.cfg0"/>
						</Preference>
						<Preference name="SCENE_PIXEL_DIMENSION" priority="REQUIRED" objectId="dim_640_480"/>
						<Preference name="SCENE_PIXEL_LOCATION" priority="REQUIRED" objectId="point_0_0"/>
						<Preference name="SCENE_SCREEN_DIMENSION" priority="REQUIRED">